<?xml version='1.0' encoding='utf-8'?>

<!--
<!DOCTYPE partition PUBLIC
  "-//Penrose/DTD Partition 1.2//EN"
  "http://penrose.safehaus.org/dtd/partition.dtd">
-->

<!ELEMENT partition (name, description?, source-cache*, entry-cache*)>
<!ATTLIST partition enabled (true|false) "true">

<!ELEMENT entry-cache (cache-class?, description?, parameter*)>
<!ATTLIST entry-cache name CDATA #IMPLIED>

<!ELEMENT source-cache (cache-class?, description?, parameter*)>
<!ATTLIST source-cache name CDATA #IMPLIED>

<!ELEMENT name (#PCDATA)>

<!ELEMENT description (#PCDATA)>

<!ELEMENT cache-class (#PCDATA)>

<!ELEMENT parameter (param-name, param-value)>
<!ELEMENT param-name (#PCDATA)>
<!ELEMENT param-value (#PCDATA)>
